"DESCRIPTION","DURATION IN MS","NAME","PARENT SUITE","START TIME","STATUS","STOP TIME","SUB SUITE","SUITE","TEST CLASS","TEST METHOD"
"","516","User can remove item from cart","","2026-04-13","failed","2026-04-13","","","",""
"","791","User can complete purchase successfully","","2026-04-13","passed","2026-04-13","","","",""
"","434","User can add item to cart","","2026-04-13","passed","2026-04-13","","","",""
"","455","User can add multiple items to cart","","2026-04-13","passed","2026-04-13","","","",""
"","388","User can login with valid credentials","","2026-04-13","passed","2026-04-13","","","",""
